id,Topic1,Topic2,Topic3,Topic4,Topic5,Topic6,Topic7,Topic8,Topic9,Topic10,Dominant_topic,summary,Document,year
367,0.222305081,0.001266036,0.694428983,0.001266257,0.023633112,0.001266108,0.001266137,0.001266059,0.052036261,0.001265965,Topic3,"Interior tomography for the region-of-interest (ROI) imaging has advantages
of using a small detector and reducing X-ray radiation dose. However, standard
analytic reconstruction suffers from severe cupping artifacts due to existence
of null space in the truncated Radon transform. Existing penalized
reconstruction methods may address this problem but they require extensive
computations due to the iterative reconstruction. Inspired by the recent deep
learning approaches to low-dose and sparse view CT, here we propose a deep
learning architecture that removes null space signals from the FBP
reconstruction. Experimental results have shown that the proposed method
provides near-perfect reconstruction with about 7-10 dB improvement in PSNR
over existing methods in spite of significantly reduced run-time complexity.",Deep Learning Interior Tomography for Region-of-Interest Reconstruction,2017
368,0.189482522,0.001052867,0.299349177,0.277883632,0.001052986,0.001052885,0.001052872,0.146929738,0.0810905,0.00105282,Topic3,"For homeland and transportation security applications, 2D X-ray explosive
detection system (EDS) have been widely used, but they have limitations in
recognizing 3D shape of the hidden objects. Among various types of 3D computed
tomography (CT) systems to address this issue, this paper is interested in a
stationary CT using fixed X-ray sources and detectors. However, due to the
limited number of projection views, analytic reconstruction algorithms produce
severe streaking artifacts. Inspired by recent success of deep learning
approach for sparse view CT reconstruction, here we propose a novel image and
sinogram domain deep learning architecture for 3D reconstruction from very
sparse view measurement. The algorithm has been tested with the real data from
a prototype 9-view dual energy stationary CT EDS carry-on baggage scanner
developed by GEMSS Medical Systems, Korea, which confirms the superior
reconstruction performance over the existing approaches.",Deep Learning Reconstruction for 9-View Dual Energy CT Baggage Scanner,2018
369,0.000763554,0.000763541,0.000763514,0.000763492,0.000763521,0.00076355,0.197657209,0.00076348,0.796234614,0.000763524,Topic9,"Deep learning has shown promising results on many machine learning tasks but
DL models are often complex networks with large number of neurons and layers,
and recently, complex layer structures known as building blocks. Finding the
best deep model requires a combination of finding both the right architecture
and the correct set of parameters appropriate for that architecture. In
addition, this complexity (in terms of layer types, number of neurons, and
number of layers) also present problems with generalization since larger
networks are easier to overfit to the data. In this paper, we propose a search
framework for finding effective architectural building blocks for convolutional
neural networks (CNN). Our approach is much faster at finding models that are
close to state-of-the-art in performance. In addition, the models discovered by
our approach are also smaller than models discovered by similar techniques. We
achieve these twin advantages by designing our search space in such a way that
it searches over a reduced set of state-of-the-art building blocks for CNNs
including residual block, inception block, inception-residual block, ResNeXt
block and many others. We apply this technique to generate models for multiple
image datasets and show that these models achieve performance comparable to
state-of-the-art (and even surpassing the state-of-the-art in one case). We
also show that learned models are transferable between datasets.","Effective Building Block Design for Deep Convolutional Neural Networks
  using Search",2018
370,0.434668737,0.000877402,0.000877424,0.000877334,0.000877404,0.265622272,0.000877393,0.00087742,0.293567152,0.000877463,Topic1,"Deep metric learning has been demonstrated to be highly effective in learning
semantic representation and encoding information that can be used to measure
data similarity, by relying on the embedding learned from metric learning. At
the same time, variational autoencoder (VAE) has widely been used to
approximate inference and proved to have a good performance for directed
probabilistic models. However, for traditional VAE, the data label or feature
information are intractable. Similarly, traditional representation learning
approaches fail to represent many salient aspects of the data. In this project,
we propose a novel integrated framework to learn latent embedding in VAE by
incorporating deep metric learning. The features are learned by optimizing a
triplet loss on the mean vectors of VAE in conjunction with standard evidence
lower bound (ELBO) of VAE. This approach, which we call Triplet based
Variational Autoencoder (TVAE), allows us to capture more fine-grained
information in the latent embedding. Our model is tested on MNIST data set and
achieves a high triplet accuracy of 95.60% while the traditional VAE (Kingma &
Welling, 2013) achieves triplet accuracy of 75.08%.",TVAE: Triplet-Based Variational Autoencoder using Metric Learning,2018
371,0.000833592,0.000833566,0.000833474,0.061060503,0.721593416,0.126386156,0.000833449,0.000833542,0.085958793,0.000833509,Topic5,"Infants are experts at playing, with an amazing ability to generate novel
structured behaviors in unstructured environments that lack clear extrinsic
reward signals. We seek to mathematically formalize these abilities using a
neural network that implements curiosity-driven intrinsic motivation. Using a
simple but ecologically naturalistic simulated environment in which an agent
can move and interact with objects it sees, we propose a ""world-model"" network
that learns to predict the dynamic consequences of the agent's actions.
Simultaneously, we train a separate explicit ""self-model"" that allows the agent
to track the error map of its own world-model, and then uses the self-model to
adversarially challenge the developing world-model. We demonstrate that this
policy causes the agent to explore novel and informative interactions with its
environment, leading to the generation of a spectrum of complex behaviors,
including ego-motion prediction, object attention, and object gathering.
Moreover, the world-model that the agent learns supports improved performance
on object dynamics prediction, detection, localization and recognition tasks.
Taken together, our results are initial steps toward creating flexible
autonomous agents that self-supervise in complex novel physical environments.",Learning to Play with Intrinsically-Motivated Self-Aware Agents,2018
372,0.000961862,0.000961848,0.000961704,0.000961928,0.811267207,0.131713813,0.000961664,0.000961761,0.05028651,0.000961704,Topic5,"Infants are experts at playing, with an amazing ability to generate novel
structured behaviors in unstructured environments that lack clear extrinsic
reward signals. We seek to replicate some of these abilities with a neural
network that implements curiosity-driven intrinsic motivation. Using a simple
but ecologically naturalistic simulated environment in which the agent can move
and interact with objects it sees, the agent learns a world model predicting
the dynamic consequences of its actions. Simultaneously, the agent learns to
take actions that adversarially challenge the developing world model, pushing
the agent to explore novel and informative interactions with its environment.
We demonstrate that this policy leads to the self-supervised emergence of a
spectrum of complex behaviors, including ego motion prediction, object
attention, and object gathering. Moreover, the world model that the agent
learns supports improved performance on object dynamics prediction and
localization tasks. Our results are a proof-of-principle that computational
models of intrinsic motivation might account for key features of developmental
visuomotor learning in infants.","Emergence of Structured Behaviors from Curiosity-Based Intrinsic
  Motivation",2018
373,0.751842084,0.001667063,0.001666851,0.001666961,0.001667211,0.234821892,0.001667003,0.001667045,0.001666939,0.001666949,Topic1,"Generating video frames that accurately predict future world states is
challenging. Existing approaches either fail to capture the full distribution
of outcomes, or yield blurry generations, or both. In this paper we introduce
an unsupervised video generation model that learns a prior model of uncertainty
in a given environment. Video frames are generated by drawing samples from this
prior and combining them with a deterministic estimate of the future frame. The
approach is simple and easily trained end-to-end on a variety of datasets.
Sample generations are both varied and sharp, even many frames into the future,
and compare favorably to those from existing approaches.",Stochastic Video Generation with a Learned Prior,2018
374,0.502103055,0.000680337,0.00068039,0.166880218,0.000680414,0.000680383,0.000680507,0.000680357,0.32625396,0.00068038,Topic1,"Supervised object detection and semantic segmentation require object or even
pixel level annotations. When there exist image level labels only, it is
challenging for weakly supervised algorithms to achieve accurate predictions.
The accuracy achieved by top weakly supervised algorithms is still
significantly lower than their fully supervised counterparts. In this paper, we
propose a novel weakly supervised curriculum learning pipeline for multi-label
object recognition, detection and semantic segmentation. In this pipeline, we
first obtain intermediate object localization and pixel labeling results for
the training images, and then use such results to train task-specific deep
networks in a fully supervised manner. The entire process consists of four
stages, including object localization in the training images, filtering and
fusing object instances, pixel labeling for the training images, and
task-specific network training. To obtain clean object instances in the
training images, we propose a novel algorithm for filtering, fusing and
classifying object instances collected from multiple solution mechanisms. In
this algorithm, we incorporate both metric learning and density-based
clustering to filter detected object instances. Experiments show that our
weakly supervised pipeline achieves state-of-the-art results in multi-label
image classification as well as weakly supervised object detection and very
competitive results in weakly supervised semantic segmentation on MS-COCO,
PASCAL VOC 2007 and PASCAL VOC 2012.","Multi-Evidence Filtering and Fusion for Multi-Label Classification,
  Object Detection and Semantic Segmentation Based on Weakly Supervised
  Learning",2018
375,0.04255365,0.418306604,0.001449703,0.001449593,0.001449565,0.001449689,0.001449562,0.001449456,0.528992602,0.001449577,Topic9,"In the recent literature the important role of depth in deep learning has
been emphasized. In this paper we argue that sufficient width of a feedforward
network is equally important by answering the simple question under which
conditions the decision regions of a neural network are connected. It turns out
that for a class of activation functions including leaky ReLU, neural networks
having a pyramidal structure, that is no layer has more hidden units than the
input dimension, produce necessarily connected decision regions. This implies
that a sufficiently wide layer is necessary to produce disconnected decision
regions. We discuss the implications of this result for the construction of
neural networks, in particular the relation to the problem of adversarial
manipulation of classifiers.","Neural Networks Should Be Wide Enough to Learn Disconnected Decision
  Regions",2018
376,0.001351928,0.001351626,0.112490365,0.00135176,0.462565429,0.001351516,0.001351626,0.001351671,0.4154825,0.001351579,Topic5,"We develop three efficient approaches for generating visual explanations from
3D convolutional neural networks (3D-CNNs) for Alzheimer's disease
classification. One approach conducts sensitivity analysis on hierarchical 3D
image segmentation, and the other two visualize network activations on a
spatial map. Visual checks and a quantitative localization benchmark indicate
that all approaches identify important brain parts for Alzheimer's disease
diagnosis. Comparative analysis show that the sensitivity analysis based
approach has difficulty handling loosely distributed cerebral cortex, and
approaches based on visualization of activations are constrained by the
resolution of the convolutional layer. The complementarity of these methods
improves the understanding of 3D-CNNs in Alzheimer's disease classification
from different perspectives.","Visual Explanations From Deep 3D Convolutional Neural Networks for
  Alzheimer's Disease Classification",2018
377,0.180566818,0.001204943,0.001204987,0.001205226,0.001204937,0.00120511,0.3425738,0.001204928,0.468424293,0.001204958,Topic9,"Deep neural networks are typically trained by optimizing a loss function with
an SGD variant, in conjunction with a decaying learning rate, until
convergence. We show that simple averaging of multiple points along the
trajectory of SGD, with a cyclical or constant learning rate, leads to better
generalization than conventional training. We also show that this Stochastic
Weight Averaging (SWA) procedure finds much broader optima than SGD, and
approximates the recent Fast Geometric Ensembling (FGE) approach with a single
model. Using SWA we achieve notable improvement in test accuracy over
conventional SGD training on a range of state-of-the-art residual networks,
PyramidNets, DenseNets, and Shake-Shake networks on CIFAR-10, CIFAR-100, and
ImageNet. In short, SWA is extremely easy to implement, improves
generalization, and has almost no computational overhead.",Averaging Weights Leads to Wider Optima and Better Generalization,2018
378,0.00060621,0.000606264,0.208533884,0.043492466,0.00060617,0.179463835,0.164181097,0.000606248,0.345985294,0.055918533,Topic9,"By drawing on ideas from optimisation theory, artificial neural networks
(ANN), graph embeddings and sparse representations, I develop a novel
technique, termed SENNS (Sparse Extraction Neural NetworkS), aimed at
addressing the feature extraction problem. The proposed method uses (preferably
deep) ANNs for projecting input attribute vectors to an output space wherein
pairwise distances are maximized for vectors belonging to different classes,
but minimized for those belonging to the same class, while simultaneously
enforcing sparsity on the ANN outputs. The vectors that result from the
projection can then be used as features in any classifier of choice.
Mathematically, I formulate the proposed method as the minimisation of an
objective function which can be interpreted, in the ANN output space, as a
negative factor of the sum of the squares of the pair-wise distances between
output vectors belonging to different classes, added to a positive factor of
the sum of squares of the pair-wise distances between output vectors belonging
to the same classes, plus sparsity and weight decay terms. To derive an
algorithm for minimizing the objective function via gradient descent, I use the
multi-variate version of the chain rule to obtain the partial derivatives of
the function with respect to ANN weights and biases, and find that each of the
required partial derivatives can be expressed as a sum of six terms. As it
turns out, four of those six terms can be computed using the standard back
propagation algorithm; the fifth can be computed via a slight modification of
the standard backpropagation algorithm; while the sixth one can be computed via
simple arithmetic. Finally, I propose experiments on the ARABASE Arabic corpora
of digits and letters, the CMU PIE database of faces, the MNIST digits
database, and other standard machine learning databases.",SENNS: Sparse Extraction Neural NetworkS for Feature Extraction,2014
379,0.436107271,0.001219808,0.001219734,0.001219692,0.049543753,0.505810346,0.00121979,0.001219871,0.001219891,0.001219843,Topic6,"We propose a method to optimize the representation and distinguishability of
samples from two probability distributions, by maximizing the estimated power
of a statistical test based on the maximum mean discrepancy (MMD). This
optimized MMD is applied to the setting of unsupervised learning by generative
adversarial networks (GAN), in which a model attempts to generate realistic
samples, and a discriminator attempts to tell these apart from data samples. In
this context, the MMD may be used in two roles: first, as a discriminator,
either directly on the samples, or on features of the samples. Second, the MMD
can be used to evaluate the performance of a generative model, by testing the
model's samples against a reference data set. In the latter role, the optimized
MMD is particularly helpful, as it gives an interpretable indication of how the
model and data distributions differ, even in cases where individual model
samples are not easily distinguished either by eye or by classifier.","Generative Models and Model Criticism via Optimized Maximum Mean
  Discrepancy",2016
380,0.001449657,0.001449562,0.06123036,0.001449624,0.001449627,0.468788144,0.175302172,0.001449802,0.285981558,0.001449494,Topic6,"Many real world stochastic control problems suffer from the ""curse of
dimensionality"". To overcome this difficulty, we develop a deep learning
approach that directly solves high-dimensional stochastic control problems
based on Monte-Carlo sampling. We approximate the time-dependent controls as
feedforward neural networks and stack these networks together through model
dynamics. The objective function for the control problem plays the role of the
loss function for the deep neural network. We test this approach using examples
from the areas of optimal trading and energy storage. Our results suggest that
the algorithm presented here achieves satisfactory accuracy and at the same
time, can handle rather high dimensional problems.",Deep Learning Approximation for Stochastic Control Problems,2016
381,0.22251895,0.211657425,0.001041838,0.001041832,0.42764626,0.001041966,0.001041942,0.001041882,0.131925862,0.001042043,Topic5,"In de novo drug design, computational strategies are used to generate novel
molecules with good affinity to the desired biological target. In this work, we
show that recurrent neural networks can be trained as generative models for
molecular structures, similar to statistical language models in natural
language processing. We demonstrate that the properties of the generated
molecules correlate very well with the properties of the molecules used to
train the model. In order to enrich libraries with molecules active towards a
given biological target, we propose to fine-tune the model with small sets of
molecules, which are known to be active against that target.
  Against Staphylococcus aureus, the model reproduced 14% of 6051 hold-out test
molecules that medicinal chemists designed, whereas against Plasmodium
falciparum (Malaria) it reproduced 28% of 1240 test molecules. When coupled
with a scoring function, our model can perform the complete de novo drug design
cycle to generate large sets of novel molecules for drug discovery.","Generating Focussed Molecule Libraries for Drug Discovery with Recurrent
  Neural Networks",2017
382,0.001234935,0.001234804,0.001234835,0.001234978,0.001235115,0.726936526,0.149245802,0.001234933,0.115173243,0.001234829,Topic6,"Deep reinforcement learning (RL) methods generally engage in exploratory
behavior through noise injection in the action space. An alternative is to add
noise directly to the agent's parameters, which can lead to more consistent
exploration and a richer set of behaviors. Methods such as evolutionary
strategies use parameter perturbations, but discard all temporal structure in
the process and require significantly more samples. Combining parameter noise
with traditional RL methods allows to combine the best of both worlds. We
demonstrate that both off- and on-policy methods benefit from this approach
through experimental comparison of DQN, DDPG, and TRPO on high-dimensional
discrete action environments as well as continuous control tasks. Our results
show that RL with parameter noise learns more efficiently than traditional RL
with action space noise and evolutionary strategies individually.",Parameter Space Noise for Exploration,2017
383,0.000793789,0.065212851,0.000793765,0.038615778,0.000793862,0.259968506,0.000793917,0.206098289,0.381920891,0.045008352,Topic9,"With the development of neural networks based machine learning and their
usage in mission critical applications, voices are rising against the
\textit{black box} aspect of neural networks as it becomes crucial to
understand their limits and capabilities. With the rise of neuromorphic
hardware, it is even more critical to understand how a neural network, as a
distributed system, tolerates the failures of its computing nodes, neurons, and
its communication channels, synapses. Experimentally assessing the robustness
of neural networks involves the quixotic venture of testing all the possible
failures, on all the possible inputs, which ultimately hits a combinatorial
explosion for the first, and the impossibility to gather all the possible
inputs for the second.
  In this paper, we prove an upper bound on the expected error of the output
when a subset of neurons crashes. This bound involves dependencies on the
network parameters that can be seen as being too pessimistic in the average
case. It involves a polynomial dependency on the Lipschitz coefficient of the
neurons activation function, and an exponential dependency on the depth of the
layer where a failure occurs. We back up our theoretical results with
experiments illustrating the extent to which our prediction matches the
dependencies between the network parameters and robustness. Our results show
that the robustness of neural networks to the average crash can be estimated
without the need to neither test the network on all failure configurations, nor
access the training set used to train the network, both of which are
practically impossible requirements.",On The Robustness of a Neural Network,2017
384,0.001333707,0.16922839,0.00133346,0.00133347,0.00133377,0.248373546,0.001333661,0.001333608,0.573062721,0.001333667,Topic9,"In this paper we introduce ZhuSuan, a python probabilistic programming
library for Bayesian deep learning, which conjoins the complimentary advantages
of Bayesian methods and deep learning. ZhuSuan is built upon Tensorflow. Unlike
existing deep learning libraries, which are mainly designed for deterministic
neural networks and supervised tasks, ZhuSuan is featured for its deep root
into Bayesian inference, thus supporting various kinds of probabilistic models,
including both the traditional hierarchical Bayesian models and recent deep
generative models. We use running examples to illustrate the probabilistic
programming on ZhuSuan, including Bayesian logistic regression, variational
auto-encoders, deep sigmoid belief networks and Bayesian recurrent neural
networks.",ZhuSuan: A Library for Bayesian Deep Learning,2017
385,0.000787677,0.000787535,0.000787603,0.000787608,0.000787596,0.505009876,0.352182176,0.137294723,0.000787639,0.000787567,Topic6,"The most data-efficient algorithms for reinforcement learning in robotics are
model-based policy search algorithms, which alternate between learning a
dynamical model of the robot and optimizing a policy to maximize the expected
return given the model and its uncertainties. Among the few proposed
approaches, the recently introduced Black-DROPS algorithm exploits a black-box
optimization algorithm to achieve both high data-efficiency and good
computation times when several cores are used; nevertheless, like all
model-based policy search approaches, Black-DROPS does not scale to high
dimensional state/action spaces. In this paper, we introduce a new model
learning procedure in Black-DROPS that leverages parameterized black-box priors
to (1) scale up to high-dimensional systems, and (2) be robust to large
inaccuracies of the prior information. We demonstrate the effectiveness of our
approach with the ""pendubot"" swing-up task in simulation and with a physical
hexapod robot (48D state space, 18D action space) that has to walk forward as
fast as possible. The results show that our new algorithm is more
data-efficient than previous model-based policy search algorithms (with and
without priors) and that it can allow a physical 6-legged robot to learn new
gaits in only 16 to 30 seconds of interaction time.","Using Parameterized Black-Box Priors to Scale Up Model-Based Policy
  Search for Robotics",2017
