id,Topic1,Topic2,Topic3,Topic4,Topic5,Topic6,Topic7,Topic8,Topic9,Topic10,Dominant_topic,summary,Document,year
0,0.273666224,0.046231112,0.001470735,0.00147078,0.001470871,0.001470792,0.001470817,0.001470825,0.497716476,0.173561368,Topic9,"We propose an architecture for VQA which utilizes recurrent layers to
generate visual and textual attention. The memory characteristic of the
proposed recurrent attention units offers a rich joint embedding of visual and
textual features and enables the model to reason relations between several
parts of the image and question. Our single model outperforms the first place
winner on the VQA 1.0 dataset, performs within margin to the current
state-of-the-art ensemble model. We also experiment with replacing attention
mechanisms in other state-of-the-art models with our implementation and show
increased accuracy. In both cases, our recurrent attention mechanism improves
performance in tasks requiring sequential or relational reasoning on the VQA
dataset.",Dual Recurrent Attention Units for Visual Question Answering,2018
1,0.001786053,0.00178595,0.001785897,0.001785938,0.001786032,0.001785904,0.001785916,0.001786014,0.452359498,0.533352799,Topic10,"Recent approaches based on artificial neural networks (ANNs) have shown
promising results for short-text classification. However, many short texts
occur in sequences (e.g., sentences in a document or utterances in a dialog),
and most existing ANN-based systems do not leverage the preceding short texts
when classifying a subsequent one. In this work, we present a model based on
recurrent neural networks and convolutional neural networks that incorporates
the preceding short texts. Our model achieves state-of-the-art results on three
different datasets for dialog act prediction.","Sequential Short-Text Classification with Recurrent and Convolutional
  Neural Networks",2016
2,0.000724872,0.00072483,0.000724874,0.000724839,0.000724794,0.209096132,0.000724794,0.000724808,0.071789675,0.714040383,Topic10,"We introduce the multiresolution recurrent neural network, which extends the
sequence-to-sequence framework to model natural language generation as two
parallel discrete stochastic processes: a sequence of high-level coarse tokens,
and a sequence of natural language tokens. There are many ways to estimate or
learn the high-level coarse tokens, but we argue that a simple extraction
procedure is sufficient to capture a wealth of high-level discourse semantics.
Such procedure allows training the multiresolution recurrent neural network by
maximizing the exact joint log-likelihood over both sequences. In contrast to
the standard log- likelihood objective w.r.t. natural language tokens (word
perplexity), optimizing the joint log-likelihood biases the model towards
modeling high-level abstractions. We apply the proposed model to the task of
dialogue response generation in two challenging domains: the Ubuntu technical
support domain, and Twitter conversations. On Ubuntu, the model outperforms
competing approaches by a substantial margin, achieving state-of-the-art
results according to both automatic evaluation metrics and a human evaluation
study. On Twitter, the model appears to generate more relevant and on-topic
responses according to automatic evaluation metrics. Finally, our experiments
demonstrate that the proposed model is more adept at overcoming the sparsity of
natural language and is better able to capture long-term structure.","Multiresolution Recurrent Neural Networks: An Application to Dialogue
  Response Generation",2016
3,0.000934769,0.000934863,0.021658287,0.000934795,0.000934926,0.000934859,0.10631408,0.000934765,0.614430235,0.251988422,Topic9,"Multi-task learning is motivated by the observation that humans bring to bear
what they know about related problems when solving new ones. Similarly, deep
neural networks can profit from related tasks by sharing parameters with other
networks. However, humans do not consciously decide to transfer knowledge
between tasks. In Natural Language Processing (NLP), it is hard to predict if
sharing will lead to improvements, particularly if tasks are only loosely
related. To overcome this, we introduce Sluice Networks, a general framework
for multi-task learning where trainable parameters control the amount of
sharing. Our framework generalizes previous proposals in enabling sharing of
all combinations of subspaces, layers, and skip connections. We perform
experiments on three task pairs, and across seven different domains, using data
from OntoNotes 5.0, and achieve up to 15% average error reductions over common
approaches to multi-task learning. We show that a) label entropy is predictive
of gains in sluice networks, confirming findings for hard parameter sharing and
b) while sluice networks easily fit noise, they are robust across domains in
practice.",Learning what to share between loosely related tasks,2017
4,0.001219768,0.001219676,0.001219686,0.001219773,0.085849282,0.2345062,0.001219804,0.001219822,0.17833703,0.493988959,Topic10,"We present MILABOT: a deep reinforcement learning chatbot developed by the
Montreal Institute for Learning Algorithms (MILA) for the Amazon Alexa Prize
competition. MILABOT is capable of conversing with humans on popular small talk
topics through both speech and text. The system consists of an ensemble of
natural language generation and retrieval models, including template-based
models, bag-of-words models, sequence-to-sequence neural network and latent
variable neural network models. By applying reinforcement learning to
crowdsourced data and real-world user interactions, the system has been trained
to select an appropriate response from the models in its ensemble. The system
has been evaluated through A/B testing with real-world users, where it
performed significantly better than many competing systems. Due to its machine
learning architecture, the system is likely to improve with additional data.",A Deep Reinforcement Learning Chatbot,2017
5,0.145462813,0.001852225,0.001852205,0.001852088,0.001852174,0.033356476,0.001852224,0.001852291,0.001852255,0.808215249,Topic10,"We propose a new generative model of sentences that first samples a prototype
sentence from the training corpus and then edits it into a new sentence.
Compared to traditional models that generate from scratch either left-to-right
or by first sampling a latent sentence vector, our prototype-then-edit model
improves perplexity on language modeling and generates higher quality outputs
according to human evaluation. Furthermore, the model gives rise to a latent
edit vector that captures interpretable semantics such as sentence similarity
and sentence-level analogies.",Generating Sentences by Editing Prototypes,2017
6,0.001219752,0.001219749,0.001219671,0.001219841,0.235593753,0.222299654,0.001219828,0.001219861,0.153810309,0.380977583,Topic10,"We present MILABOT: a deep reinforcement learning chatbot developed by the
Montreal Institute for Learning Algorithms (MILA) for the Amazon Alexa Prize
competition. MILABOT is capable of conversing with humans on popular small talk
topics through both speech and text. The system consists of an ensemble of
natural language generation and retrieval models, including neural network and
template-based models. By applying reinforcement learning to crowdsourced data
and real-world user interactions, the system has been trained to select an
appropriate response from the models in its ensemble. The system has been
evaluated through A/B testing with real-world users, where it performed
significantly better than other systems. The results highlight the potential of
coupling ensemble systems with deep reinforcement learning as a fruitful path
for developing real-world, open-domain conversational agents.",A Deep Reinforcement Learning Chatbot (Short Version),2018
7,0.001176769,0.001176707,0.203643094,0.143054798,0.001176647,0.001176777,0.001176824,0.14762125,0.001176717,0.498620416,Topic10,"The paper introduces a new method for discrimination of documents given in
different scripts. The document is mapped into a uniformly coded text of
numerical values. It is derived from the position of the letters in the text
line, based on their typographical characteristics. Each code is considered as
a gray level. Accordingly, the coded text determines a 1-D image, on which
texture analysis by run-length statistics and local binary pattern is
performed. It defines feature vectors representing the script content of the
document. A modified clustering approach employed on document feature vector
groups documents written in the same script. Experimentation performed on two
custom oriented databases of historical documents in old Cyrillic, angular and
round Glagolitic as well as Antiqua and Fraktur scripts demonstrates the
superiority of the proposed method with respect to well-known methods in the
state-of-the-art.",Document Image Coding and Clustering for Script Discrimination,2016
8,0.434995573,0.001408876,0.00140863,0.001408706,0.077761014,0.001408677,0.001408713,0.001408785,0.167085477,0.311705548,Topic1,"Together with the development of more accurate methods in Computer Vision and
Natural Language Understanding, holistic architectures that answer on questions
about the content of real-world images have emerged. In this tutorial, we build
a neural-based approach to answer questions about images. We base our tutorial
on two datasets: (mostly on) DAQUAR, and (a bit on) VQA. With small tweaks the
models that we present here can achieve a competitive performance on both
datasets, in fact, they are among the best methods that use a combination of
LSTM with a global, full frame CNN representation of an image. We hope that
after reading this tutorial, the reader will be able to use Deep Learning
frameworks, such as Keras and introduced Kraino, to build various architectures
that will lead to a further performance improvement on this challenging task.",Tutorial on Answering Questions about Images with Deep Learning,2016
9,0.299958816,0.002222621,0.002222481,0.002222513,0.002222802,0.002222754,0.00222252,0.419967348,0.002223022,0.264515123,Topic8,"Transforming a graphical user interface screenshot created by a designer into
computer code is a typical task conducted by a developer in order to build
customized software, websites, and mobile applications. In this paper, we show
that deep learning methods can be leveraged to train a model end-to-end to
automatically generate code from a single input image with over 77% of accuracy
for three different platforms (i.e. iOS, Android and web-based technologies).",pix2code: Generating Code from a Graphical User Interface Screenshot,2017
10,0.001639676,0.001639689,0.001639861,0.00163955,0.001639522,0.001640157,0.001639684,0.001639636,0.548922336,0.43795989,Topic9,"Learned feature representations and sub-phoneme posteriors from Deep Neural
Networks (DNNs) have been used separately to produce significant performance
gains for speaker and language recognition tasks. In this work we show how
these gains are possible using a single DNN for both speaker and language
recognition. The unified DNN approach is shown to yield substantial performance
improvements on the the 2013 Domain Adaptation Challenge speaker recognition
task (55% reduction in EER for the out-of-domain condition) and on the NIST
2011 Language Recognition Evaluation (48% reduction in EER for the 30s test
condition).",A Unified Deep Neural Network for Speaker and Language Recognition,2015
11,0.000885157,0.000885068,0.000885077,0.000885122,0.000885169,0.071221465,0.237741605,0.000885269,0.603898333,0.081827734,Topic9,"We propose Efficient Neural Architecture Search (ENAS), a fast and
inexpensive approach for automatic model design. In ENAS, a controller learns
to discover neural network architectures by searching for an optimal subgraph
within a large computational graph. The controller is trained with policy
gradient to select a subgraph that maximizes the expected reward on the
validation set. Meanwhile the model corresponding to the selected subgraph is
trained to minimize a canonical cross entropy loss. Thanks to parameter sharing
between child models, ENAS is fast: it delivers strong empirical performances
using much fewer GPU-hours than all existing automatic model design approaches,
and notably, 1000x less expensive than standard Neural Architecture Search. On
the Penn Treebank dataset, ENAS discovers a novel architecture that achieves a
test perplexity of 55.8, establishing a new state-of-the-art among all methods
without post-training processing. On the CIFAR-10 dataset, ENAS designs novel
architectures that achieve a test error of 2.89%, which is on par with NASNet
(Zoph et al., 2018), whose test error is 2.65%.",Efficient Neural Architecture Search via Parameter Sharing,2018
12,0.000877754,0.104584649,0.000877303,0.000877573,0.619730081,0.000877349,0.000877345,0.000877466,0.269543074,0.000877405,Topic5,"Recent progress in artificial intelligence (AI) has renewed interest in
building systems that learn and think like people. Many advances have come from
using deep neural networks trained end-to-end in tasks such as object
recognition, video games, and board games, achieving performance that equals or
even beats humans in some respects. Despite their biological inspiration and
performance achievements, these systems differ from human intelligence in
crucial ways. We review progress in cognitive science suggesting that truly
human-like learning and thinking machines will have to reach beyond current
engineering trends in both what they learn, and how they learn it.
Specifically, we argue that these machines should (a) build causal models of
the world that support explanation and understanding, rather than merely
solving pattern recognition problems; (b) ground learning in intuitive theories
of physics and psychology, to support and enrich the knowledge that is learned;
and (c) harness compositionality and learning-to-learn to rapidly acquire and
generalize knowledge to new tasks and situations. We suggest concrete
challenges and promising routes towards these goals that can combine the
strengths of recent neural network advances with more structured cognitive
models.",Building Machines That Learn and Think Like People,2016
13,0.000869806,0.066669563,0.00086965,0.000869707,0.367305928,0.224097101,0.000869673,0.000869769,0.237328694,0.100250107,Topic5,"While perception tasks such as visual object recognition and text
understanding play an important role in human intelligence, the subsequent
tasks that involve inference, reasoning and planning require an even higher
level of intelligence. The past few years have seen major advances in many
perception tasks using deep learning models. For higher-level inference,
however, probabilistic graphical models with their Bayesian nature are still
more powerful and flexible. To achieve integrated intelligence that involves
both perception and inference, it is naturally desirable to tightly integrate
deep learning and Bayesian models within a principled probabilistic framework,
which we call Bayesian deep learning. In this unified framework, the perception
of text or images using deep learning can boost the performance of higher-level
inference and in return, the feedback from the inference process is able to
enhance the perception of text or images. This survey provides a general
introduction to Bayesian deep learning and reviews its recent applications on
recommender systems, topic models, and control. In this survey, we also discuss
the relationship and differences between Bayesian deep learning and other
related topics like Bayesian treatment of neural networks.",Towards Bayesian Deep Learning: A Survey,2016
14,0.000909337,0.085733675,0.000909328,0.000909246,0.216891649,0.691009394,0.000909284,0.000909307,0.000909484,0.000909296,Topic6,"Learning goal-directed behavior in environments with sparse feedback is a
major challenge for reinforcement learning algorithms. The primary difficulty
arises due to insufficient exploration, resulting in an agent being unable to
learn robust value functions. Intrinsically motivated agents can explore new
behavior for its own sake rather than to directly solve problems. Such
intrinsic behaviors could eventually help the agent solve tasks posed by the
environment. We present hierarchical-DQN (h-DQN), a framework to integrate
hierarchical value functions, operating at different temporal scales, with
intrinsically motivated deep reinforcement learning. A top-level value function
learns a policy over intrinsic goals, and a lower-level function learns a
policy over atomic actions to satisfy the given goals. h-DQN allows for
flexible goal specifications, such as functions over entities and relations.
This provides an efficient space for exploration in complicated environments.
We demonstrate the strength of our approach on two problems with very sparse,
delayed feedback: (1) a complex discrete stochastic decision process, and (2)
the classic ATARI game `Montezuma's Revenge'.","Hierarchical Deep Reinforcement Learning: Integrating Temporal
  Abstraction and Intrinsic Motivation",2016
15,0.781689248,0.001136724,0.001136587,0.001136712,0.209217464,0.001136649,0.001136638,0.001136606,0.001136715,0.001136657,Topic1,"This paper presents a novel yet intuitive approach to unsupervised feature
learning. Inspired by the human visual system, we explore whether low-level
motion-based grouping cues can be used to learn an effective visual
representation. Specifically, we use unsupervised motion-based segmentation on
videos to obtain segments, which we use as 'pseudo ground truth' to train a
convolutional network to segment objects from a single frame. Given the
extensive evidence that motion plays a key role in the development of the human
visual system, we hope that this straightforward approach to unsupervised
learning will be more effective than cleverly designed 'pretext' tasks studied
in the literature. Indeed, our extensive experiments show that this is the
case. When used for transfer learning on object detection, our representation
significantly outperforms previous unsupervised approaches across multiple
settings, especially when training data for the target task is scarce.",Learning Features by Watching Objects Move,2016
16,0.42604176,0.00137019,0.001370203,0.001370198,0.001370214,0.290893434,0.001370189,0.001370086,0.273473521,0.001370205,Topic1,"We propose a simple neural network model to deal with the domain adaptation
problem in object recognition. Our model incorporates the Maximum Mean
Discrepancy (MMD) measure as a regularization in the supervised learning to
reduce the distribution mismatch between the source and target domains in the
latent space. From experiments, we demonstrate that the MMD regularization is
an effective tool to provide good domain adaptation models on both SURF
features and raw image pixels of a particular image data set. We also show that
our proposed model, preceded by the denoising auto-encoder pretraining,
achieves better performance than recent benchmark models on the same data sets.
This work represents the first study of MMD measure in the context of neural
networks.",Domain Adaptive Neural Networks for Object Recognition,2014
17,0.203655785,0.001075488,0.001075429,0.001075449,0.001075539,0.001075441,0.001075445,0.135856738,0.559155098,0.094879588,Topic9,"Recent studies have demonstrated the power of recurrent neural networks for
machine translation, image captioning and speech recognition. For the task of
capturing temporal structure in video, however, there still remain numerous
open research questions. Current research suggests using a simple temporal
feature pooling strategy to take into account the temporal aspect of video. We
demonstrate that this method is not sufficient for gesture recognition, where
temporal information is more discriminative compared to general video
classification tasks. We explore deep architectures for gesture recognition in
video and propose a new end-to-end trainable neural network architecture
incorporating temporal convolutions and bidirectional recurrence. Our main
contributions are twofold; first, we show that recurrence is crucial for this
task; second, we show that adding temporal convolutions leads to significant
improvements. We evaluate the different approaches on the Montalbano gesture
recognition dataset, where we achieve state-of-the-art results.","Beyond Temporal Pooling: Recurrence and Temporal Convolutions for
  Gesture Recognition in Video",2015
18,0.001299024,0.052027271,0.001298876,0.075777325,0.001298978,0.001299182,0.001298943,0.001298939,0.468389534,0.396011928,Topic9,"In this paper, we address the task of Optical Character Recognition(OCR) for
the Telugu script. We present an end-to-end framework that segments the text
image, classifies the characters and extracts lines using a language model. The
segmentation is based on mathematical morphology. The classification module,
which is the most challenging task of the three, is a deep convolutional neural
network. The language is modelled as a third degree markov chain at the glyph
level. Telugu script is a complex alphasyllabary and the language is
agglutinative, making the problem hard. In this paper we apply the latest
advances in neural networks to achieve state-of-the-art error rates. We also
review convolutional neural networks in great detail and expound the
statistical justification behind the many tricks needed to make Deep Learning
work.",Telugu OCR Framework using Deep Learning,2015
19,0.560567925,0.001149758,0.001149737,0.001149608,0.001149742,0.300656365,0.001149704,0.001149639,0.130727792,0.00114973,Topic1,"The ability of the Generative Adversarial Networks (GANs) framework to learn
generative models mapping from simple latent distributions to arbitrarily
complex data distributions has been demonstrated empirically, with compelling
results showing that the latent space of such generators captures semantic
variation in the data distribution. Intuitively, models trained to predict
these semantic latent representations given data may serve as useful feature
representations for auxiliary problems where semantics are relevant. However,
in their existing form, GANs have no means of learning the inverse mapping --
projecting data back into the latent space. We propose Bidirectional Generative
Adversarial Networks (BiGANs) as a means of learning this inverse mapping, and
demonstrate that the resulting learned feature representation is useful for
auxiliary supervised discrimination tasks, competitive with contemporary
approaches to unsupervised and self-supervised feature learning.",Adversarial Feature Learning,2016
20,0.001149637,0.220952171,0.001149704,0.001149609,0.530953744,0.193832484,0.001149591,0.001149591,0.047363509,0.001149959,Topic5,"Supervised machine learning models boast remarkable predictive capabilities.
But can you trust your model? Will it work in deployment? What else can it tell
you about the world? We want models to be not only good, but interpretable. And
yet the task of interpretation appears underspecified. Papers provide diverse
and sometimes non-overlapping motivations for interpretability, and offer
myriad notions of what attributes render models interpretable. Despite this
ambiguity, many papers proclaim interpretability axiomatically, absent further
explanation. In this paper, we seek to refine the discourse on
interpretability. First, we examine the motivations underlying interest in
interpretability, finding them to be diverse and occasionally discordant. Then,
we address model properties and techniques thought to confer interpretability,
identifying transparency to humans and post-hoc explanations as competing
notions. Throughout, we discuss the feasibility and desirability of different
notions, and question the oft-made assertions that linear models are
interpretable and that deep neural networks are not.",The Mythos of Model Interpretability,2016
