id,Topic1,Topic2,Topic3,Topic4,Topic5,Topic6,Topic7,Topic8,Topic9,Topic10,Dominant_topic,summary,Document,year
125,0.187824672,0.001136751,0.001136545,0.001136805,0.001136806,0.001136562,0.001136541,0.001136681,0.407833051,0.396385586,Topic9,"Visual question answering is fundamentally compositional in nature---a
question like ""where is the dog?"" shares substructure with questions like ""what
color is the dog?"" and ""where is the cat?"" This paper seeks to simultaneously
exploit the representational capacity of deep networks and the compositional
linguistic structure of questions. We describe a procedure for constructing and
learning *neural module networks*, which compose collections of jointly-trained
neural ""modules"" into deep networks for question answering. Our approach
decomposes questions into their linguistic substructures, and uses these
structures to dynamically instantiate modular networks (with reusable
components for recognizing dogs, classifying colors, etc.). The resulting
compound networks are jointly trained. We evaluate our approach on two
challenging datasets for visual question answering, achieving state-of-the-art
results on both the VQA natural image dataset and a new dataset of complex
questions about abstract shapes.",Neural Module Networks,2015
126,0.234456701,0.299750285,0.000847767,0.000847711,0.000847746,0.000847727,0.000847774,0.152958479,0.061640599,0.24695521,Topic2,"In this paper, we extend a symbolic association framework for being able to
handle missing elements in multimodal sequences. The general scope of the work
is the symbolic associations of object-word mappings as it happens in language
development in infants. In other words, two different representations of the
same abstract concepts can associate in both directions. This scenario has been
long interested in Artificial Intelligence, Psychology, and Neuroscience. In
this work, we extend a recent approach for multimodal sequences (visual and
audio) to also cope with missing elements in one or both modalities. Our method
uses two parallel Long Short-Term Memories (LSTMs) with a learning rule based
on EM-algorithm. It aligns both LSTM outputs via Dynamic Time Warping (DTW). We
propose to include an extra step for the combination with the max operation for
exploiting the common elements between both sequences. The motivation behind is
that the combination acts as a condition selector for choosing the best
representation from both LSTMs. We evaluated the proposed extension in the
following scenarios: missing elements in one modality (visual or audio) and
missing elements in both modalities (visual and sound). The performance of our
extension reaches better results than the original model and similar results to
individual LSTM trained in each modality.","Symbol Grounding Association in Multimodal Sequences with Missing
  Elements",2015
127,0.451338974,0.001020641,0.072913922,0.00102073,0.284155635,0.001020721,0.001020697,0.001020591,0.15511862,0.031369469,Topic1,"The growing importance of massive datasets with the advent of deep learning
makes robustness to label noise a critical property for classifiers to have.
Sources of label noise include automatic labeling for large datasets,
non-expert labeling, and label corruption by data poisoning adversaries. In the
latter case, corruptions may be arbitrarily bad, even so bad that a classifier
predicts the wrong labels with high confidence. To protect against such sources
of noise, we leverage the fact that a small set of clean labels is often easy
to procure. We demonstrate that robustness to label noise up to severe
strengths can be achieved by using a set of trusted data with clean labels, and
propose a loss correction that utilizes trusted examples in a data-efficient
manner to mitigate the effects of label noise on deep neural network
classifiers. Across vision and natural language processing tasks, we experiment
with various label noises at several strengths, and show that our method
significantly outperforms existing methods.","Using Trusted Data to Train Deep Networks on Labels Corrupted by Severe
  Noise",2018
128,0.12862468,0.001234942,0.001234753,0.001234763,0.00123484,0.062232948,0.001234865,0.001234854,0.556486229,0.245247126,Topic9,"Whereas deep neural networks were first mostly used for classification tasks,
they are rapidly expanding in the realm of structured output problems, where
the observed target is composed of multiple random variables that have a rich
joint distribution, given the input. We focus in this paper on the case where
the input also has a rich structure and the input and output structures are
somehow related. We describe systems that learn to attend to different places
in the input, for each element of the output, for a variety of tasks: machine
translation, image caption generation, video clip description and speech
recognition. All these systems are based on a shared set of building blocks:
gated recurrent neural networks and convolutional neural networks, along with
trained attention mechanisms. We report on experimental results with these
systems, showing impressively good performance and the advantage of the
attention mechanism.","Describing Multimedia Content using Attention-based Encoder--Decoder
  Networks",2015
129,0.431467181,0.001587637,0.001587576,0.001587556,0.001587578,0.001587584,0.001587497,0.001587532,0.00158767,0.555832188,Topic10,"In this paper we present an approach to multi-language image description
bringing together insights from neural machine translation and neural image
description. To create a description of an image for a given target language,
our sequence generation models condition on feature vectors from the image, the
description from the source language, and/or a multimodal vector computed over
the image and a description in the source language. In image description
experiments on the IAPR-TC12 dataset of images aligned with English and German
sentences, we find significant and substantial improvements in BLEU4 and Meteor
scores for models trained over multiple languages, compared to a monolingual
baseline.",Multilingual Image Description with Neural Sequence Models,2015
130,0.14607377,0.001111354,0.001111315,0.001111465,0.06342149,0.001111334,0.00111137,0.109847512,0.353763851,0.321336539,Topic9,"This paper introduces the visually informed embedding of word (VIEW), a
continuous vector representation for a word extracted from a deep neural model
trained using the Microsoft COCO data set to forecast the spatial arrangements
between visual objects, given a textual description. The model is composed of a
deep multilayer perceptron (MLP) stacked on the top of a Long Short Term Memory
(LSTM) network, the latter being preceded by an embedding layer. The VIEW is
applied to transferring multimodal background knowledge to Spatial Role
Labeling (SpRL) algorithms, which recognize spatial relations between objects
mentioned in the text. This work also contributes with a new method to select
complementary features and a fine-tuning method for MLP that improves the $F1$
measure in classifying the words into spatial roles. The VIEW is evaluated with
the Task 3 of SemEval-2013 benchmark data set, SpaceEval.",Deep Embedding for Spatial Role Labeling,2016
131,0.31791824,0.04561819,0.113300737,0.001205085,0.001205108,0.001205116,0.001205126,0.001205161,0.231702547,0.285434689,Topic1,"We present a neural encoder-decoder model to convert images into
presentational markup based on a scalable coarse-to-fine attention mechanism.
Our method is evaluated in the context of image-to-LaTeX generation, and we
introduce a new dataset of real-world rendered mathematical expressions paired
with LaTeX markup. We show that unlike neural OCR techniques using CTC-based
models, attention-based approaches can tackle this non-standard OCR task. Our
approach outperforms classical mathematical OCR systems by a large margin on
in-domain rendered data, and, with pretraining, also performs well on
out-of-domain handwritten data. To reduce the inference complexity associated
with the attention-based approaches, we introduce a new coarse-to-fine
attention layer that selects a support region before applying attention.",Image-to-Markup Generation with Coarse-to-Fine Attention,2016
132,0.364520276,0.028663548,0.151834134,0.001428827,0.001428882,0.001428797,0.001428777,0.001428945,0.071976303,0.375861512,Topic10,"We present a deep recurrent neural network model with soft visual attention
that learns to generate LaTeX markup of real-world math formulas given their
images. Applying neural sequence generation techniques that have been very
successful in the fields of machine translation and image/handwriting/speech
captioning, recognition, transcription and synthesis, we construct an
image-to-markup model that learns to produce syntactically and semantically
correct LaTeX markup code of over 150 words long and achieves a BLEU score of
89%; the best reported so far for the Im2Latex problem. We also visually
demonstrate that the model learns to scan the image left-right / up-down much
as a human would read it.","Teaching Machines to Code: Neural Markup Generation with Visual
  Attention",2018
133,0.075131713,0.00056515,0.000565116,0.000565088,0.00056513,0.000565082,0.252449801,0.11008239,0.558945483,0.000565046,Topic9,"A promising paradigm for achieving highly efficient deep neural networks is
the idea of evolutionary deep intelligence, which mimics biological evolution
processes to progressively synthesize more efficient networks. A crucial design
factor in evolutionary deep intelligence is the genetic encoding scheme used to
simulate heredity and determine the architectures of offspring networks. In
this study, we take a deeper look at the notion of synaptic cluster-driven
evolution of deep neural networks which guides the evolution process towards
the formation of a highly sparse set of synaptic clusters in offspring
networks. Utilizing a synaptic cluster-driven genetic encoding, the
probabilistic encoding of synaptic traits considers not only individual
synaptic properties but also inter-synaptic relationships within a deep neural
network. This process results in highly sparse offspring networks which are
particularly tailored for parallel computational devices such as GPUs and deep
neural network accelerator chips. Comprehensive experimental results using four
well-known deep neural network architectures (LeNet-5, AlexNet, ResNet-56, and
DetectNet) on two different tasks (object categorization and object detection)
demonstrate the efficiency of the proposed method. Cluster-driven genetic
encoding scheme synthesizes networks that can achieve state-of-the-art
performance with significantly smaller number of synapses than that of the
original ancestor network. ($\sim$125-fold decrease in synapses for MNIST).
Furthermore, the improved cluster efficiency in the generated offspring
networks ($\sim$9.71-fold decrease in clusters for MNIST and a $\sim$8.16-fold
decrease in clusters for KITTI) is particularly useful for accelerated
performance on parallel computing hardware architectures such as those in GPUs
and deep neural network accelerator chips.","Evolution in Groups: A deeper look at synaptic cluster driven evolution
  of deep neural networks",2017
134,0.000714402,0.000714488,0.448102998,0.000714508,0.000714465,0.000714511,0.000714501,0.32285046,0.191724011,0.033035655,Topic3,"A relatively recent advance in cognitive neuroscience has been multi-voxel
pattern analysis (MVPA), which enables researchers to decode brain states
and/or the type of information represented in the brain during a cognitive
operation. MVPA methods utilize machine learning algorithms to distinguish
among types of information or cognitive states represented in the brain, based
on distributed patterns of neural activity. In the current investigation, we
propose a new approach for representation of neural data for pattern analysis,
namely a Mesh Learning Model. In this approach, at each time instant, a star
mesh is formed around each voxel, such that the voxel corresponding to the
center node is surrounded by its p-nearest neighbors. The arc weights of each
mesh are estimated from the voxel intensity values by least squares method. The
estimated arc weights of all the meshes, called Mesh Arc Descriptors (MADs),
are then used to train a classifier, such as Neural Networks, k-Nearest
Neighbor, Na\""ive Bayes and Support Vector Machines. The proposed Mesh Model
was tested on neuroimaging data acquired via functional magnetic resonance
imaging (fMRI) during a recognition memory experiment using categorized word
lists, employing a previously established experimental paradigm (\""Oztekin &
Badre, 2011). Results suggest that the proposed Mesh Learning approach can
provide an effective algorithm for pattern analysis of brain activity during
cognitive processing.",Mesh Learning for Classifying Cognitive Processes,2012
135,0.001587975,0.001587881,0.001587607,0.001587615,0.001587863,0.320436131,0.001587753,0.001587992,0.666861594,0.001587587,Topic9,"In this work, we perform an exploratory study on synthesizing deep neural
networks using biological synaptic strength distributions, and the potential
influence of different distributions on modelling performance particularly for
the scenario associated with small data sets. Surprisingly, a CNN with
convolutional layer synaptic strengths drawn from biologically-inspired
distributions such as log-normal or correlated center-surround distributions
performed relatively well suggesting a possibility for designing deep neural
network architectures that do not require many data samples to learn, and can
sidestep current training procedures while maintaining or boosting modelling
performance.","Synthesizing Deep Neural Network Architectures using Biological Synaptic
  Strength Distributions",2017
136,0.001205007,0.001205118,0.001204996,0.437236705,0.001205045,0.001205074,0.553123,0.001205087,0.001205013,0.001204955,Topic7,"Addressing the issue of SVMs parameters optimization, this study proposes an
efficient memetic algorithm based on Particle Swarm Optimization algorithm
(PSO) and Pattern Search (PS). In the proposed memetic algorithm, PSO is
responsible for exploration of the search space and the detection of the
potential regions with optimum solutions, while pattern search (PS) is used to
produce an effective exploitation on the potential regions obtained by PSO.
Moreover, a novel probabilistic selection strategy is proposed to select the
appropriate individuals among the current population to undergo local
refinement, keeping a well balance between exploration and exploitation.
Experimental results confirm that the local refinement with PS and our proposed
selection strategy are effective, and finally demonstrate effectiveness and
robustness of the proposed PSO-PS based MA for SVMs parameters optimization.","A PSO and Pattern Search based Memetic Algorithm for SVMs Parameters
  Optimization",2014
137,0.224043307,0.001470894,0.001471175,0.001470918,0.001471062,0.764189063,0.001470941,0.00147078,0.001470944,0.001470917,Topic6,"Unsupervised learning of probabilistic models is a central yet challenging
problem in machine learning. Specifically, designing models with tractable
learning, sampling, inference and evaluation is crucial in solving this task.
We extend the space of such models using real-valued non-volume preserving
(real NVP) transformations, a set of powerful invertible and learnable
transformations, resulting in an unsupervised learning algorithm with exact
log-likelihood computation, exact sampling, exact inference of latent
variables, and an interpretable latent space. We demonstrate its ability to
model natural images on four datasets through sampling, log-likelihood
evaluation and latent variable manipulations.",Density estimation using Real NVP,2016
138,0.001123936,0.001123807,0.001123759,0.001124422,0.001124337,0.318660382,0.495162284,0.17830935,0.001123942,0.001123782,Topic7,"We explore the use of Evolution Strategies (ES), a class of black box
optimization algorithms, as an alternative to popular MDP-based RL techniques
such as Q-learning and Policy Gradients. Experiments on MuJoCo and Atari show
that ES is a viable solution strategy that scales extremely well with the
number of CPUs available: By using a novel communication strategy based on
common random numbers, our ES implementation only needs to communicate scalars,
making it possible to scale to over a thousand parallel workers. This allows us
to solve 3D humanoid walking in 10 minutes and obtain competitive results on
most Atari games after one hour of training. In addition, we highlight several
advantages of ES as a black box optimization technique: it is invariant to
action frequency and delayed rewards, tolerant of extremely long horizons, and
does not need temporal discounting or value function approximation.",Evolution Strategies as a Scalable Alternative to Reinforcement Learning,2017
139,0.001123831,0.128488043,0.001123768,0.001123824,0.001123807,0.076411471,0.224109588,0.001123781,0.564248067,0.001123819,Topic9,"This paper introduces the QMDP-net, a neural network architecture for
planning under partial observability. The QMDP-net combines the strengths of
model-free learning and model-based planning. It is a recurrent policy network,
but it represents a policy for a parameterized set of tasks by connecting a
model with a planning algorithm that solves the model, thus embedding the
solution structure of planning in a network learning architecture. The QMDP-net
is fully differentiable and allows for end-to-end training. We train a QMDP-net
on different tasks so that it can generalize to new ones in the parameterized
task set and ""transfer"" to other similar tasks beyond the set. In preliminary
experiments, QMDP-net showed strong performance on several robotic tasks in
simulation. Interestingly, while QMDP-net encodes the QMDP algorithm, it
sometimes outperforms the QMDP algorithm in the experiments, as a result of
end-to-end learning.",QMDP-Net: Deep Learning for Planning under Partial Observability,2017
140,0.211115314,0.071017305,0.000730034,0.000730071,0.000730103,0.429274,0.057594831,0.000730071,0.227348125,0.000730146,Topic6,"Combining deep model-free reinforcement learning with on-line planning is a
promising approach to building on the successes of deep RL. On-line planning
with look-ahead trees has proven successful in environments where transition
models are known a priori. However, in complex environments where transition
models need to be learned from data, the deficiencies of learned models have
limited their utility for planning. To address these challenges, we propose
TreeQN, a differentiable, recursive, tree-structured model that serves as a
drop-in replacement for any value function network in deep RL with discrete
actions. TreeQN dynamically constructs a tree by recursively applying a
transition model in a learned abstract state space and then aggregating
predicted rewards and state-values using a tree backup to estimate Q-values. We
also propose ATreeC, an actor-critic variant that augments TreeQN with a
softmax layer to form a stochastic policy network. Both approaches are trained
end-to-end, such that the learned model is optimised for its actual use in the
tree. We show that TreeQN and ATreeC outperform n-step DQN and A2C on a
box-pushing task, as well as n-step DQN and value prediction networks (Oh et
al. 2017) on multiple Atari games. Furthermore, we present ablation studies
that demonstrate the effect of different auxiliary losses on learning
transition models.","TreeQN and ATreeC: Differentiable Tree-Structured Models for Deep
  Reinforcement Learning",2017
141,0.001031146,0.001031187,0.001031205,0.001031124,0.001031222,0.199782101,0.189221874,0.001031148,0.603777797,0.001031194,Topic9,"A major drawback of backpropagation through time (BPTT) is the difficulty of
learning long-term dependencies, coming from having to propagate credit
information backwards through every single step of the forward computation.
This makes BPTT both computationally impractical and biologically implausible.
For this reason, full backpropagation through time is rarely used on long
sequences, and truncated backpropagation through time is used as a heuristic.
However, this usually leads to biased estimates of the gradient in which longer
term dependencies are ignored. Addressing this issue, we propose an alternative
algorithm, Sparse Attentive Backtracking, which might also be related to
principles used by brains to learn long-term dependencies. Sparse Attentive
Backtracking learns an attention mechanism over the hidden states of the past
and selectively backpropagates through paths with high attention weights. This
allows the model to learn long term dependencies while only backtracking for a
small number of time steps, not just from the recent past but also from
attended relevant past states.","Sparse Attentive Backtracking: Long-Range Credit Assignment in Recurrent
  Networks",2017
142,0.050788838,0.001087195,0.001087493,0.001087369,0.001087141,0.067228238,0.156776069,0.409357106,0.310413406,0.001087144,Topic8,"We study the performance of stochastically trained deep neural networks
(DNNs) whose synaptic weights are implemented using emerging memristive devices
that exhibit limited dynamic range, resolution, and variability in their
programming characteristics. We show that a key device parameter to optimize
the learning efficiency of DNNs is the variability in its programming
characteristics. DNNs with such memristive synapses, even with dynamic range as
low as $15$ and only $32$ discrete levels, when trained based on stochastic
updates suffer less than $3\%$ loss in accuracy compared to floating point
software baseline. We also study the performance of stochastic memristive DNNs
when used as inference engines with noise corrupted data and find that if the
device variability can be minimized, the relative degradation in performance
for the Stochastic DNN is better than that of the software baseline. Hence, our
study presents a new optimization corner for memristive devices for building
large noise-immune deep learning systems.",Stochastic Deep Learning in Memristive Networks,2017
143,0.000943621,0.00094362,0.000943583,0.179894672,0.192864251,0.000943722,0.516496496,0.000943613,0.105082741,0.00094368,Topic7,"Multi-step-ahead time series prediction is one of the most challenging
research topics in the field of time series modeling and prediction, and is
continually under research. Recently, the multiple-input several
multiple-outputs (MISMO) modeling strategy has been proposed as a promising
alternative for multi-step-ahead time series prediction, exhibiting advantages
compared with the two currently dominating strategies, the iterated and the
direct strategies. Built on the established MISMO strategy, this study proposes
a particle swarm optimization (PSO)-based MISMO modeling strategy, which is
capable of determining the number of sub-models in a self-adaptive mode, with
varying prediction horizons. Rather than deriving crisp divides with equal-size
s prediction horizons from the established MISMO, the proposed PSO-MISMO
strategy, implemented with neural networks, employs a heuristic to create
flexible divides with varying sizes of prediction horizons and to generate
corresponding sub-models, providing considerable flexibility in model
construction, which has been validated with simulated and real datasets.",PSO-MISMO Modeling Strategy for Multi-Step-Ahead Time Series Prediction,2013
144,0.008334213,0.008335273,0.008338535,0.008334328,0.008333907,0.563181763,0.008335678,0.008334037,0.370138351,0.008333913,Topic6,"We investigate the capacity, convexity and characterization of a general
family of norm-constrained feed-forward networks.",Norm-Based Capacity Control in Neural Networks,2015
145,0.001695326,0.130842306,0.001695282,0.001695264,0.001695235,0.088414596,0.321968572,0.001695465,0.448602599,0.001695354,Topic9,"The method presented extends a given regression neural network to make its
performance improve. The modification affects the learning procedure only,
hence the extension may be easily omitted during evaluation without any change
in prediction. It means that the modified model may be evaluated as quickly as
the original one but tends to perform better.
  This improvement is possible because the modification gives better expressive
power, provides better behaved gradients and works as a regularization. The
knowledge gained by the temporarily extended neural network is contained in the
parameters shared with the original neural network.
  The only cost is an increase in learning time.","Improving the Performance of Neural Networks in Regression Tasks Using
  Drawering",2016
