id,Topic1,Topic2,Topic3,Topic4,Topic5,Topic6,Topic7,Topic8,Topic9,Topic10,Dominant_topic,summary,Document,year
248,0.094719631,0.000806657,0.000806586,0.000806663,0.000806641,0.041772984,0.331939515,0.00080659,0.52672815,0.000806581,Topic9,"We present an approach to adaptively utilize deep neural networks in order to
reduce the evaluation time on new examples without loss of accuracy. Rather
than attempting to redesign or approximate existing networks, we propose two
schemes that adaptively utilize networks. We first pose an adaptive network
evaluation scheme, where we learn a system to adaptively choose the components
of a deep network to be evaluated for each example. By allowing examples
correctly classified using early layers of the system to exit, we avoid the
computational time associated with full evaluation of the network. We extend
this to learn a network selection system that adaptively selects the network to
be evaluated for each example. We show that computational time can be
dramatically reduced by exploiting the fact that many examples can be correctly
classified using relatively efficient networks and that complex,
computationally costly networks are only necessary for a small fraction of
examples. We pose a global objective for learning an adaptive early exit or
network selection policy and solve it by reducing the policy learning problem
to a layer-by-layer weighted binary classification problem. Empirically, these
approaches yield dramatic reductions in computational cost, with up to a 2.8x
speedup on state-of-the-art networks from the ImageNet image recognition
challenge with minimal (<1%) loss of top5 accuracy.",Adaptive Neural Networks for Efficient Inference,2017
249,0.627297964,0.001041893,0.092671147,0.001041863,0.001041834,0.213775637,0.00104184,0.060003926,0.001041976,0.00104192,Topic1,"The key idea of variational auto-encoders (VAEs) resembles that of
traditional auto-encoder models in which spatial information is supposed to be
explicitly encoded in the latent space. However, the latent variables in VAEs
are vectors, which are commonly interpreted as multiple feature maps of size
1x1. Such representations can only convey spatial information implicitly when
coupled with powerful decoders. In this work, we propose spatial VAEs that use
latent variables as feature maps of larger size to explicitly capture spatial
information. This is achieved by allowing the latent variables to be sampled
from matrix-variate normal (MVN) distributions whose parameters are computed
from the encoder network. To increase dependencies among locations on latent
feature maps and reduce the number of parameters, we further propose spatial
VAEs via low-rank MVN distributions. Experimental results show that the
proposed spatial VAEs outperform original VAEs in capturing rich structural and
spatial information.","Spatial Variational Auto-Encoding via Matrix-Variate Normal
  Distributions",2017
250,0.345232157,0.001075536,0.001075479,0.16693383,0.001075644,0.001075546,0.00107555,0.001075538,0.48030508,0.001075639,Topic9,"The key idea of current deep learning methods for dense prediction is to
apply a model on a regular patch centered on each pixel to make pixel-wise
predictions. These methods are limited in the sense that the patches are
determined by network architecture instead of learned from data. In this work,
we propose the dense transformer networks, which can learn the shapes and sizes
of patches from data. The dense transformer networks employ an encoder-decoder
architecture, and a pair of dense transformer modules are inserted into each of
the encoder and decoder paths. The novelty of this work is that we provide
technical solutions for learning the shapes and sizes of patches from data and
efficiently restoring the spatial correspondence required for dense prediction.
The proposed dense transformer modules are differentiable, thus the entire
network can be trained. We apply the proposed networks on natural and
biological image segmentation tasks and show superior performance is achieved
in comparison to baseline methods.",Dense Transformer Networks,2017
251,0.001111275,0.001111329,0.060550473,0.001111305,0.001111388,0.08417264,0.435233425,0.001111374,0.41337552,0.00111127,Topic7,"We develop an algorithm for systematic design of a large artificial neural
network using a progression property. We find that some non-linear functions,
such as the rectifier linear unit and its derivatives, hold the property. The
systematic design addresses the choice of network size and regularization of
parameters. The number of nodes and layers in network increases in progression
with the objective of consistently reducing an appropriate cost. Each layer is
optimized at a time, where appropriate parameters are learned using convex
optimization. Regularization parameters for convex optimization do not need a
significant manual effort for tuning. We also use random instances for some
weight matrices, and that helps to reduce the number of parameters we learn.
The developed network is expected to show good generalization power due to
appropriate regularization and use of random weights in the layers. This
expectation is verified by extensive experiments for classification and
regression problems, using standard databases.",Progressive Learning for Systematic Design of Large Neural Networks,2017
252,0.600626765,0.001111395,0.001111365,0.001111316,0.306937904,0.08465537,0.001111464,0.001111358,0.001111471,0.001111592,Topic1,"A fundamental, and still largely unanswered, question in the context of
Generative Adversarial Networks (GANs) is whether GANs are actually able to
capture the key characteristics of the datasets they are trained on. The
current approaches to examining this issue require significant human
supervision, such as visual inspection of sampled images, and often offer only
fairly limited scalability. In this paper, we propose new techniques that
employ a classification-based perspective to evaluate synthetic GAN
distributions and their capability to accurately reflect the essential
properties of the training data. These techniques require only minimal human
supervision and can easily be scaled and adapted to evaluate a variety of
state-of-the-art GANs on large, popular datasets. Our analysis indicates that
GANs have significant problems in reproducing the more distributional
properties of the training dataset. In particular, when seen through the lens
of classification, the diversity of GAN data is orders of magnitude less than
that of the original data.",A Classification-Based Perspective on GAN Distributions,2017
253,0.308168567,0.315142392,0.000934757,0.000934772,0.000934858,0.000934844,0.000934824,0.000934802,0.370145297,0.000934886,Topic9,"Achieving artificial visual reasoning - the ability to answer image-related
questions which require a multi-step, high-level process - is an important step
towards artificial general intelligence. This multi-modal task requires
learning a question-dependent, structured reasoning process over images from
language. Standard deep learning approaches tend to exploit biases in the data
rather than learn this underlying structure, while leading methods learn to
visually reason successfully but are hand-crafted for reasoning. We show that a
general-purpose, Conditional Batch Normalization approach achieves
state-of-the-art results on the CLEVR Visual Reasoning benchmark with a 2.4%
error rate. We outperform the next best end-to-end method (4.5%) and even
methods that use extra supervision (3.1%). We probe our model to shed light on
how it reasons, showing it has learned a question-dependent, multi-step
process. Previous work has operated under the assumption that visual reasoning
calls for a specialized architecture, but we show that a general architecture
with proper conditioning can learn to visually reason effectively.",Learning Visual Reasoning Without Strong Priors,2017
254,0.234044785,0.000909302,0.000909361,0.000909355,0.28761666,0.000909365,0.119495261,0.000909317,0.144700289,0.209596303,Topic5,"Language is increasingly being used to define rich visual recognition
problems with supporting image collections sourced from the web. Structured
prediction models are used in these tasks to take advantage of correlations
between co-occurring labels and visual input but risk inadvertently encoding
social biases found in web corpora. In this work, we study data and models
associated with multilabel object classification and visual semantic role
labeling. We find that (a) datasets for these tasks contain significant gender
bias and (b) models trained on these datasets further amplify existing bias.
For example, the activity cooking is over 33% more likely to involve females
than males in a training set, and a trained model further amplifies the
disparity to 68% at test time. We propose to inject corpus-level constraints
for calibrating existing structured prediction models and design an algorithm
based on Lagrangian relaxation for collective inference. Our method results in
almost no performance loss for the underlying recognition task but decreases
the magnitude of bias amplification by 47.5% and 40.5% for multilabel
classification and visual semantic role labeling, respectively.","Men Also Like Shopping: Reducing Gender Bias Amplification using
  Corpus-level Constraints",2017
255,0.19294039,0.055899816,0.000666781,0.079015123,0.318475063,0.000666888,0.00066679,0.098862449,0.000666863,0.252139837,Topic5,"Spatial understanding is a fundamental problem with wide-reaching real-world
applications. The representation of spatial knowledge is often modeled with
spatial templates, i.e., regions of acceptability of two objects under an
explicit spatial relationship (e.g., ""on"", ""below"", etc.). In contrast with
prior work that restricts spatial templates to explicit spatial prepositions
(e.g., ""glass on table""), here we extend this concept to implicit spatial
language, i.e., those relationships (generally actions) for which the spatial
arrangement of the objects is only implicitly implied (e.g., ""man riding
horse""). In contrast with explicit relationships, predicting spatial
arrangements from implicit spatial language requires significant common sense
spatial understanding. Here, we introduce the task of predicting spatial
templates for two objects under a relationship, which can be seen as a spatial
question-answering task with a (2D) continuous output (""where is the man w.r.t.
a horse when the man is walking the horse?""). We present two simple
neural-based models that leverage annotated images and structured text to learn
this task. The good performance of these models reveals that spatial locations
are to a large extent predictable from implicit spatial language. Crucially,
the models attain similar performance in a challenging generalized setting,
where the object-relation-object combinations (e.g.,""man walking dog"") have
never been seen before. Next, we go one step further by presenting the models
with unseen objects (e.g., ""dog""). In this scenario, we show that leveraging
word embeddings enables the models to output accurate spatial predictions,
proving that the models acquire solid common sense spatial knowledge allowing
for such generalization.","Acquiring Common Sense Spatial Knowledge through Implicit Spatial
  Templates",2017
256,0.001235005,0.167419768,0.001234898,0.001235095,0.001234867,0.001234844,0.001234779,0.001234856,0.822700916,0.001234971,Topic9,"We introduce a general-purpose conditioning method for neural networks called
FiLM: Feature-wise Linear Modulation. FiLM layers influence neural network
computation via a simple, feature-wise affine transformation based on
conditioning information. We show that FiLM layers are highly effective for
visual reasoning - answering image-related questions which require a
multi-step, high-level process - a task which has proven difficult for standard
deep learning methods that do not explicitly model reasoning. Specifically, we
show on visual reasoning tasks that FiLM layers 1) halve state-of-the-art error
for the CLEVR benchmark, 2) modulate features in a coherent manner, 3) are
robust to ablations and architectural modifications, and 4) generalize well to
challenging, new data from few examples or even zero-shot.",FiLM: Visual Reasoning with a General Conditioning Layer,2017
257,0.099461859,0.001408839,0.165188125,0.001408847,0.001408756,0.001408817,0.001408708,0.001408622,0.001408739,0.725488688,Topic10,"We introduce a new approach to unsupervised estimation of feature-rich
semantic role labeling models. Our model consists of two components: (1) an
encoding component: a semantic role labeling model which predicts roles given a
rich set of syntactic and lexical features; (2) a reconstruction component: a
tensor factorization model which relies on roles to predict argument fillers.
When the components are estimated jointly to minimize errors in argument
reconstruction, the induced roles largely correspond to roles defined in
annotated resources. Our method performs on par with most accurate role
induction methods on English and German, even though, unlike these previous
approaches, we do not incorporate any prior linguistic knowledge about the
languages.","Unsupervised Induction of Semantic Roles within a Reconstruction-Error
  Minimization Framework",2014
258,0.000769411,0.000769413,0.000769469,0.000769425,0.465230584,0.000769405,0.108724883,0.000769393,0.000769398,0.42065862,Topic5,"The blind application of machine learning runs the risk of amplifying biases
present in data. Such a danger is facing us with word embedding, a popular
framework to represent text data as vectors which has been used in many machine
learning and natural language processing tasks. We show that even word
embeddings trained on Google News articles exhibit female/male gender
stereotypes to a disturbing extent. This raises concerns because their
widespread use, as we describe, often tends to amplify these biases.
Geometrically, gender bias is first shown to be captured by a direction in the
word embedding. Second, gender neutral words are shown to be linearly separable
from gender definition words in the word embedding. Using these properties, we
provide a methodology for modifying an embedding to remove gender stereotypes,
such as the association between between the words receptionist and female,
while maintaining desired associations such as between the words queen and
female. We define metrics to quantify both direct and indirect gender biases in
embeddings, and develop algorithms to ""debias"" the embedding. Using
crowd-worker evaluation as well as standard benchmarks, we empirically
demonstrate that our algorithms significantly reduce gender bias in embeddings
while preserving the its useful properties such as the ability to cluster
related concepts and to solve analogy tasks. The resulting embeddings can be
used in applications without amplifying gender bias.","Man is to Computer Programmer as Woman is to Homemaker? Debiasing Word
  Embeddings",2016
259,0.000719593,0.000719556,0.00071955,0.088302387,0.000719557,0.000719613,0.000719563,0.000719569,0.171631097,0.735029514,Topic10,"In this paper, we propose TopicRNN, a recurrent neural network (RNN)-based
language model designed to directly capture the global semantic meaning
relating words in a document via latent topics. Because of their sequential
nature, RNNs are good at capturing the local structure of a word sequence -
both semantic and syntactic - but might face difficulty remembering long-range
dependencies. Intuitively, these long-range dependencies are of semantic
nature. In contrast, latent topic models are able to capture the global
underlying semantic structure of a document but do not account for word
ordering. The proposed TopicRNN model integrates the merits of RNNs and latent
topic models: it captures local (syntactic) dependencies using an RNN and
global (semantic) dependencies using latent topics. Unlike previous work on
contextual RNN language modeling, our model is learned end-to-end. Empirical
results on word prediction show that TopicRNN outperforms existing contextual
RNN baselines. In addition, TopicRNN can be used as an unsupervised feature
extractor for documents. We do this for sentiment analysis on the IMDB movie
review dataset and report an error rate of $6.28\%$. This is comparable to the
state-of-the-art $5.91\%$ resulting from a semi-supervised approach. Finally,
TopicRNN also yields sensible topics, making it a useful alternative to
document models such as latent Dirichlet allocation.",TopicRNN: A Recurrent Neural Network with Long-Range Semantic Dependency,2016
260,0.001219846,0.134299717,0.001219754,0.00121993,0.001219865,0.29835303,0.001219758,0.037636546,0.046082343,0.477529211,Topic10,"We propose the Gaussian attention model for content-based neural memory
access. With the proposed attention model, a neural network has the additional
degree of freedom to control the focus of its attention from a laser sharp
attention to a broad attention. It is applicable whenever we can assume that
the distance in the latent space reflects some notion of semantics. We use the
proposed attention model as a scoring function for the embedding of a knowledge
base into a continuous vector space and then train a model that performs
question answering about the entities in the knowledge base. The proposed
attention model can handle both the propagation of uncertainty when following a
series of relations and also the conjunction of conditions in a natural way. On
a dataset of soccer players who participated in the FIFA World Cup 2014, we
demonstrate that our model can handle both path queries and conjunctive queries
well.","Gaussian Attention Model and Its Application to Knowledge Base Embedding
  and Question Answering",2016
261,0.033351177,0.001176751,0.001176709,0.001176764,0.001176894,0.171926555,0.001176846,0.001176762,0.600674248,0.186987296,Topic9,"Recurrent neural networks (RNNs) have been used extensively and with
increasing success to model various types of sequential data. Much of this
progress has been achieved through devising recurrent units and architectures
with the flexibility to capture complex statistics in the data, such as long
range dependency or localized attention phenomena. However, while many
sequential data (such as video, speech or language) can have highly variable
information flow, most recurrent models still consume input features at a
constant rate and perform a constant number of computations per time step,
which can be detrimental to both speed and model capacity. In this paper, we
explore a modification to existing recurrent units which allows them to learn
to vary the amount of computation they perform at each step, without prior
knowledge of the sequence's time structure. We show experimentally that not
only do our models require fewer operations, they also lead to better
performance overall on evaluation tasks.",Variable Computation in Recurrent Neural Networks,2016
262,0.162533423,0.001428814,0.001428917,0.001428848,0.001428947,0.102814331,0.00142902,0.0014288,0.724650008,0.001428891,Topic9,"In this paper, we propose a method for training neural networks when we have
a large set of data with weak labels and a small amount of data with true
labels. In our proposed model, we train two neural networks: a target network,
the learner and a confidence network, the meta-learner. The target network is
optimized to perform a given task and is trained using a large set of unlabeled
data that are weakly annotated. We propose to control the magnitude of the
gradient updates to the target network using the scores provided by the second
confidence network, which is trained on a small amount of supervised data. Thus
we avoid that the weight updates computed from noisy labels harm the quality of
the target network model.",Learning to Learn from Weak Supervision by Full Supervision,2017
263,0.083575061,0.09814198,0.000806574,0.000806605,0.278671843,0.000806694,0.000806806,0.091569833,0.378236961,0.066577643,Topic9,"Chemical databases store information in text representations, and the SMILES
format is a universal standard used in many cheminformatics software. Encoded
in each SMILES string is structural information that can be used to predict
complex chemical properties. In this work, we develop SMILES2vec, a deep RNN
that automatically learns features from SMILES to predict chemical properties,
without the need for additional explicit feature engineering. Using Bayesian
optimization methods to tune the network architecture, we show that an
optimized SMILES2vec model can serve as a general-purpose neural network for
predicting distinct chemical properties including toxicity, activity,
solubility and solvation energy, while also outperforming contemporary MLP
neural networks that uses engineered features. Furthermore, we demonstrate
proof-of-concept of interpretability by developing an explanation mask that
localizes on the most important characters used in making a prediction. When
tested on the solubility dataset, it identified specific parts of a chemical
that is consistent with established first-principles knowledge with an accuracy
of 88%. Our work demonstrates that neural networks can learn technically
accurate chemical concept and provide state-of-the-art accuracy, making
interpretable deep neural networks a useful tool of relevance to the chemical
industry.","SMILES2Vec: An Interpretable General-Purpose Deep Neural Network for
  Predicting Chemical Properties",2017
264,0.000819893,0.000819877,0.000819827,0.00081985,0.153635173,0.521016049,0.000819937,0.000819882,0.140153913,0.180275598,Topic6,"In spoken dialogue systems, we aim to deploy artificial intelligence to build
automated dialogue agents that can converse with humans. A part of this effort
is the policy optimisation task, which attempts to find a policy describing how
to respond to humans, in the form of a function taking the current state of the
dialogue and returning the response of the system. In this paper, we
investigate deep reinforcement learning approaches to solve this problem.
Particular attention is given to actor-critic methods, off-policy reinforcement
learning with experience replay, and various methods aimed at reducing the bias
and variance of estimators. When combined, these methods result in the
previously proposed ACER algorithm that gave competitive results in gaming
environments. These environments however are fully observable and have a
relatively small action set so in this paper we examine the application of ACER
to dialogue policy optimisation. We show that this method beats the current
state-of-the-art in deep learning approaches for spoken dialogue systems. This
not only leads to a more sample efficient algorithm that can train faster, but
also allows us to apply the algorithm in more difficult environments than
before. We thus experiment with learning in a very large action space, which
has two orders of magnitude more actions than previously considered. We find
that ACER trains significantly faster than the current state-of-the-art.","Sample Efficient Deep Reinforcement Learning for Dialogue Systems with
  Large Action Spaces",2018
265,0.002564495,0.234172858,0.332209933,0.002564633,0.002564472,0.002564911,0.002564898,0.002564423,0.002564471,0.415664905,Topic10,"In this paper we explore the ""vector semantics"" problem from the perspective
of ""almost orthogonal"" property of high-dimensional random vectors. We show
that this intriguing property can be used to ""memorize"" random vectors by
simply adding them, and we provide an efficient probabilistic solution to the
set membership problem. Also, we discuss several applications to word context
vector embeddings, document sentences similarity, and spam filtering.",High-Dimensional Vector Semantics,2018
266,0.001786265,0.231748959,0.001786319,0.001786302,0.001786102,0.001786448,0.001786346,0.001786197,0.001786281,0.753960782,Topic10,"Induction of common sense knowledge about prototypical sequences of events
has recently received much attention. Instead of inducing this knowledge in the
form of graphs, as in much of the previous work, in our method, distributed
representations of event realizations are computed based on distributed
representations of predicates and their arguments, and then these
representations are used to predict prototypical event orderings. The
parameters of the compositional process for computing the event representations
and the ranking component of the model are jointly estimated from texts. We
show that this approach results in a substantial boost in ordering performance
with respect to previous methods.",Learning Semantic Script Knowledge with Event Embeddings,2013
